"review_id","master_id","canonical_name","field_name","current_value","review_reason","required_evidence","priority","review_status","review_decision","review_notes"
"meity_review_samridh_application_url_v34201","147173e17ea741687247","SAMRIDH","application_url","","CURRENT_APPLICATION_ROUTE_NOT_VERIFIED","A current official SAMRIDH cohort notice or application portal explicitly accepting applications.","HIGH","OPEN","NEEDS_APPLICATION_VERIFICATION","Do not reuse the historical MSH logo URL. Any valid application URL must belong to a separately governed cohort or call."
"meity_review_samridh_required_documents_v34201","147173e17ea741687247","SAMRIDH","required_documents","","DOCUMENT_LIST_NOT_GOVERNED","Official cohort-specific accelerator application checklist or current Expression-of-Interest document.","MEDIUM","OPEN","NEEDS_FIELD_EVIDENCE","Document requirements may differ by cohort and must not be inferred from the permanent scheme document alone."
"meity_review_samridh_end_date_v34201","147173e17ea741687247","SAMRIDH","official_scheme_end_date","","CURRENT_DURATION_REQUIRES_VERIFICATION","Official extension, closure, continuation or revised-duration document for the permanent SAMRIDH scheme.","MEDIUM","OPEN","NEEDS_STATUS_VERIFICATION","Current information availability does not prove that the original scheme duration remains operational."
"meity_review_samridh_contact_v34201","147173e17ea741687247","SAMRIDH","contact_details","","SCHEME_SPECIFIC_CONTACT_NOT_VERIFIED","Official current SAMRIDH or cohort-specific contact details.","LOW","OPEN","NEEDS_FIELD_EVIDENCE","A general MSH contact must not be represented as a scheme-specific contact without explicit evidence."
"meity_review_tide20_extension_v34201","6af79cf6c8a213dddce8","TIDE 2.0","programme_status","HISTORICAL_INFORMATION_ONLY","NO_EXTENSION_EVIDENCE_LOCATED","Official MeitY order extending, renewing or replacing the approved TIDE 2.0 implementation period.","MEDIUM","OPEN","NEEDS_STATUS_VERIFICATION","Historical status remains correct unless an official continuation or extension document is found."
"meity_review_tide20_required_documents_v34201","6af79cf6c8a213dddce8","TIDE 2.0","required_documents","","HISTORICAL_DOCUMENT_REQUIREMENTS_NOT_CONSOLIDATED","Official historical centre-level startup application or selection checklist.","LOW","OPEN","NEEDS_FIELD_EVIDENCE","This does not block preservation of the historical scheme identity."
"meity_review_tide20_contact_v34201","6af79cf6c8a213dddce8","TIDE 2.0","contact_details","","CURRENT_SCHEME_CONTACT_NOT_APPLICABLE_OR_UNVERIFIED","Official archival or programme contact, if still maintained.","LOW","OPEN","NEEDS_FIELD_EVIDENCE","Individual incubation-centre contacts must not be presented as a single central scheme contact."
